{
  "schema_version": "0.2.0",
  "x-stability": "provisional",
  "assessment_id": "assessment-dab05a8e51bb",
  "harness_version": "0.1.0",
  "generated_at": "2026-05-29T00:00:00.000Z",
  "adapter_path": {
    "kind": "cli-command",
    "command": "harness assess --format json",
    "rationale": "The native agent-facing adapter is a deterministic CLI command so agents, plugins, skills, and CI can consume one schema-backed substrate output.",
    "rejected_paths": [
      "skills/harness-engineering is intentionally deferred so this repository does not introduce a skill-only source of truth; external workflow practices are recorded as source material for harness-native capability candidates."
    ]
  },
  "source": {
    "root": ".",
    "harness": "examples/harness.yaml",
    "harness_version": "0.1.0"
  },
  "status": "ready",
  "maturity": {
    "level": 3,
    "label": "observable",
    "score": 9,
    "max_score": 10
  },
  "scorecard_version": "0.2.0",
  "scorecard": [
    {
      "id": "harness-source",
      "label": "Harness source",
      "status": "present",
      "summary": "harness.yaml is present, schema-valid, engine-compatible, and reference-complete.",
      "evidence": [
        {
          "path": "examples/harness.yaml",
          "media_type": "application/yaml",
          "description": "Harness file."
        }
      ]
    },
    {
      "id": "policy-sandbox",
      "label": "Approval and sandbox policy",
      "status": "present",
      "summary": "Approval and sandbox policy references are configured and schema-valid.",
      "evidence": [
        {
          "path": "examples/policies/approval-policy.yaml",
          "media_type": "application/yaml",
          "description": "Policy artifact."
        },
        {
          "path": "examples/policies/sandbox-policy.yaml",
          "media_type": "application/yaml",
          "description": "Policy artifact."
        }
      ]
    },
    {
      "id": "eval-plans",
      "label": "Eval suites and tasks",
      "status": "present",
      "summary": "1 eval suite reference(s) are configured and schema-valid through harness validation.",
      "evidence": [
        {
          "path": "examples/evals/harness-self-test/v1.0.0/",
          "media_type": "application/yaml",
          "description": "Eval task suite."
        }
      ]
    },
    {
      "id": "doctor-evidence",
      "label": "Doctor evidence",
      "status": "present",
      "summary": "Doctor result status is passed.",
      "evidence": [
        {
          "path": "examples/doctor/results/pass.json",
          "media_type": "application/json",
          "description": "Doctor result artifact."
        }
      ]
    },
    {
      "id": "project-health",
      "label": "Project health evidence",
      "status": "present",
      "summary": "1 local project health check(s) passed.",
      "evidence": [
        {
          "path": "examples/health/results/pass.json",
          "media_type": "application/json",
          "description": "Health result artifact."
        }
      ]
    },
    {
      "id": "run-results",
      "label": "Run-result ledger",
      "status": "present",
      "summary": "1 run-result record(s) counted as verifier/evaluation evidence: 1 passed, 0 failed, 0 error, 0 skipped.",
      "evidence": [
        {
          "path": "examples/run-results/run-result.json",
          "media_type": "application/json",
          "description": "Run-result ledger."
        }
      ]
    },
    {
      "id": "trace-evidence",
      "label": "Trace evidence",
      "status": "present",
      "summary": "Explicit trace artifact is schema-valid.",
      "evidence": [
        {
          "path": "examples/traces/recorded-external-trace.json",
          "media_type": "application/json",
          "description": "Trace artifact."
        }
      ]
    },
    {
      "id": "scoreboard-report",
      "label": "Scoreboard and report",
      "status": "present",
      "summary": "Passing scoreboard and harness-generated report artifacts are available.",
      "evidence": [
        {
          "path": "examples/scoreboards/self-test.json",
          "media_type": "application/json",
          "description": "Scoreboard artifact."
        },
        {
          "path": "examples/reports/harness-report.md",
          "media_type": "text/markdown",
          "description": "Report artifact."
        }
      ]
    },
    {
      "id": "continuity-loop",
      "label": "Continuity and loop gates",
      "status": "present",
      "summary": "Continuity state directory and startup smoke-test settings are configured.",
      "evidence": [
        {
          "path": "examples/harness.yaml#/continuity",
          "media_type": "application/yaml",
          "description": "Continuity configuration."
        }
      ]
    },
    {
      "id": "repair-routing",
      "label": "Repair-action routing",
      "status": "advisory",
      "summary": "2 schema-valid repair action candidate(s) discovered, but none target current missing or partial assessment evidence.",
      "evidence": [
        {
          "path": "examples/repair-actions/advisory-cli-redirect.yaml",
          "media_type": "application/yaml",
          "description": "Repair-action candidate."
        },
        {
          "path": "examples/repair-actions/approved-schema-fix.yaml",
          "media_type": "application/yaml",
          "description": "Repair-action candidate."
        }
      ]
    }
  ],
  "missing_primitives": [],
  "rollout_plan": [
    {
      "step": "bootstrap",
      "title": "Bootstrap harness source and schema validation.",
      "status": "done",
      "actions": ["Run harness init if harness.yaml is missing.", "Run harness validate."]
    },
    {
      "step": "policy-and-doctor",
      "title": "Add policy, sandbox, and structural doctor checks.",
      "status": "done",
      "actions": [
        "Reference approval and sandbox policy artifacts.",
        "Run harness doctor --format json."
      ]
    },
    {
      "step": "behavioral-evidence",
      "title": "Exercise eval, trace, run-result, and scoreboard evidence.",
      "status": "done",
      "actions": [
        "Run harness eval validate.",
        "Provide externally produced scoreboard evidence when needed.",
        "Generate harness report output."
      ]
    },
    {
      "step": "continuity-gates",
      "title": "Gate long-running work with continuity and self-verification.",
      "status": "done",
      "actions": [
        "Record continuity state and self-verification evidence.",
        "Run harness loop validate before completion claims."
      ]
    },
    {
      "step": "repair-routing",
      "title": "Route agent implementation through reviewed repair or fallback paths.",
      "status": "next",
      "actions": ["Add repair-action artifacts or document CLI fallback approval flow."]
    }
  ],
  "recommendations": [],
  "implementation_routing": {
    "selected_route": "execution-loop",
    "routes": [
      {
        "id": "repair-action:approved-schema-fix",
        "kind": "repair-action",
        "status": "unavailable",
        "summary": "Repair-action target files do not overlap current missing or partial assessment evidence; approval state is approved, and the artifact is not selected for implementation routing.",
        "approval_state": "approved",
        "approval_trust": "untrusted",
        "risk_class": "low",
        "repair_mode": "preview-backed",
        "sandbox_requirement": "worktree",
        "trust_requirements": {
          "trust_level": "sandboxed",
          "sandbox_required": "worktree",
          "network_access": false,
          "secret_access": false,
          "host_file_access": false,
          "allowed_inputs": ["examples/fixtures/invalid/harness-with-plugin-key.yaml"],
          "allowed_outputs": [".harness/repairs/approved-schema-fix.patch"]
        },
        "target_files": ["examples/fixtures/invalid/harness-with-plugin-key.yaml"],
        "applicability": "not-applicable",
        "evidence": [
          {
            "path": "examples/repair-actions/approved-schema-fix.yaml",
            "media_type": "application/yaml",
            "description": "Repair-action artifact."
          }
        ]
      },
      {
        "id": "repair-action:advisory-cli-redirect",
        "kind": "repair-action",
        "status": "unavailable",
        "summary": "Repair-action target files do not overlap current missing or partial assessment evidence; approval state is proposed, and the artifact is not selected for implementation routing.",
        "approval_state": "proposed",
        "approval_trust": "untrusted",
        "risk_class": "low",
        "repair_mode": "advisory-only",
        "sandbox_requirement": "worktree",
        "trust_requirements": {
          "trust_level": "sandboxed",
          "sandbox_required": "worktree",
          "network_access": false,
          "secret_access": false,
          "host_file_access": false,
          "allowed_inputs": ["examples/harness.yaml"],
          "allowed_outputs": [".harness/repairs/advisory-cli-redirect.yaml"]
        },
        "target_files": ["examples/harness.yaml"],
        "applicability": "not-applicable",
        "evidence": [
          {
            "path": "examples/repair-actions/advisory-cli-redirect.yaml",
            "media_type": "application/yaml",
            "description": "Repair-action artifact."
          }
        ]
      },
      {
        "id": "native-execution-loop",
        "kind": "execution-loop",
        "status": "available",
        "summary": "Continuity configuration is present; agents can produce continuity/self-verification evidence and validate explicit artifacts with harness loop validate.",
        "evidence": [
          {
            "path": "examples/harness.yaml#/continuity",
            "media_type": "application/yaml",
            "description": "Continuity configuration."